{
  "$schema": "./framework.schema.json",
  "schemaVersion": "1.0.0",
  "frameworkVersion": "0.2.0",
  "templateVersion": "0.1.0",
  "scaffoldingVersion": "0.1.0",
  "name": "templatev4",
  "moduleCatalog": "modules/catalog.json",
  "modulePresets": {
    "baseline": "modules/presets/baseline.json",
    "minimal": "modules/presets/minimal.json"
  },
  "toolchains": {
    "dotnet": "10.0.401",
    "node": "24.21.0",
    "npm": "12.0.2",
    "docmd": "0.9.5",
    "angular": "22.1.6",
    "spartan": "1.4.1"
  },
  "modules": [
    "cms",
    "identity",
    "cqrs",
    "postgresql",
    "outbox",
    "quartz",
    "email",
    "localisation",
    "feature-flags",
    "idempotency",
    "storage",
    "mfa",
    "passkeys",
    "operations",
    "audit-history",
    "invitations",
    "notifications",
    "action-items",
    "privacy",
    "s3-storage",
    "role-management",
    "support",
    "organisations",
    "payments",
    "commercial-billing",
    "crm",
    "invoicing"
  ],
  "projects": {
    "Domain": "src/TemplateV4.Domain",
    "Application": "src/TemplateV4.Application",
    "Infrastructure": "src/TemplateV4.Infrastructure",
    "API": "src/TemplateV4.ApiService",
    "Worker": "src/TemplateV4.BackgroundWorker",
    "DatabaseMigrator": "src/TemplateV4.DatabaseMigrator",
    "AppHost": "src/TemplateV4.AppHost",
    "ServiceDefaults": "src/TemplateV4.ServiceDefaults",
    "Documentation": "documentation",
    "Web": "src/TemplateV4.Angular",
    "CLI": "tools/framework.mjs",
    "SharedKernel": "src/TemplateV4.SharedKernel",
    "ApplicationTests": "src/TemplateV4.Application.Tests",
    "Http": "src/TemplateV4.Http"
  },
  "workloads": {
    "Web": "src/TemplateV4.Angular/Dockerfile",
    "API": "deploy/Dockerfile.dotnet",
    "Worker": "deploy/Dockerfile.dotnet"
  },
  "generatedCode": {
    "src/TemplateV4.Angular/src/business-modules.g.ts": "tools/discover-business-modules.mjs",
    "src/TemplateV4.Angular/src/app/api": "ng-openapi-gen",
    "src/TemplateV4.Infrastructure/Persistence/Migrations": "dotnet-ef",
    "src/TemplateV4.Application/Modules/ModuleIds.g.cs": "tools/framework.mjs module-ids",
    "src/TemplateV4.Angular/src/app/core/capability-ids.ts": "tools/framework.mjs module-ids",
    "src/TemplateV4.Angular/src/business-modules.g.css": "tools/discover-business-modules.mjs"
  },
  "documentation": "documentation/docs",
  "adrs": "documentation/docs/adr",
  "extensions": {
    "dashboards": "Account-persisted shared defaults, personalizations and private dashboards; module-owned card providers with explicit sizes, formats and authorized data",
    "privateModuleDistribution": "Provider-assigned compiled module bundles; self-registered app environments, immutable admitted releases, absolute update freezes and Compose maintenance deployment",
    "releaseUpdates": "Authenticated environment-scoped resolution of the latest complete compatible admitted release set; installed modules have no runtime licensing dependency",
    "persistence": "EF Core / PostgreSQL",
    "transport": "PostgreSQL outbox / local Worker consumers",
    "email": "SMTP",
    "webPush": "VAPID Web Push; account-wide opt-in, per-browser subscriptions and generic-by-default previews",
    "storage": "S3-compatible / SeaweedFS; local flat-key filesystem fallback",
    "featureFlags": "configuration",
    "runtimeModules": "Catalog-composed application-wide PostgreSQL activation, dependency-safe transitions and typed module settings",
    "apiClient": "ng-openapi-gen",
    "documentation": "DocMD",
    "ui": "Spartan NG",
    "uiSounds": "Foley selected outcome cues; enabled by default with browser-local mute in the theme drawer",
    "access": "Identity roles with protected built-ins and delegated permissions",
    "configuration": "Administrator-only platform settings; organisation-wide name, retained logo branding and general profile; PostgreSQL-backed primary color and shared named custom palette, Spartan picker, public startup branding, all 30 FeralUI login background types and 298 color presets and accessible light/dark palettes",
    "organisationFiles": "Core organisation-wide upload accounting, shared files, attachments, administration, public links, retention and quota enforcement; every persisted upload uses the shared allowance, while the selectable file-storage capability controls only the library navigation and authenticated pages",
    "support": "Support-owned contact enquiries, requester tickets with categories and attachments with independent versioned feature settings"
  },
  "cultures": {
    "default": "en-ZA",
    "supported": [
      "en-ZA",
      "af-ZA"
    ]
  },
  "packages": {
    "TemplateV4.SharedKernel": "src/TemplateV4.SharedKernel",
    "TemplateV4.ServiceDefaults": "src/TemplateV4.ServiceDefaults",
    "TemplateV4.Domain": "src/TemplateV4.Domain",
    "TemplateV4.Application": "src/TemplateV4.Application",
    "TemplateV4.Infrastructure": "src/TemplateV4.Infrastructure",
    "TemplateV4.Http": "src/TemplateV4.Http"
  }
}
